,index,sub_ind,PID,date,stimset_rows,total_trials,nplanned_trialIDs,npresented_trialIDs,planned_trialIDs_all,presented_trialIDs_all,subtlety,subtlety_sorted,pred_color,pred_pos,responses,agents_type,strategy,feedback
53,53,15053,665a1158d75699007466a154@email.prolific.com,15,67,48,7,7,"['bbdbec2b-0ce6-4f9c-ad2d-e6392388d4fb', 'a4bd654a-f8f1-44b4-907f-0114e1caa391', '7b3797d6-d4cc-4819-b3ad-adfd144217e2', '06f1dd04-cfbc-433c-9833-32cdb01c0683', '6480385b-e9eb-45a9-88e3-aade6c90476d', '5744f837-93bf-4eba-bddf-e630dedf974e', '27771508-6d61-4618-83ca-4bc020efddfe']","['7b3797d6-d4cc-4819-b3ad-adfd144217e2', '5744f837-93bf-4eba-bddf-e630dedf974e', '27771508-6d61-4618-83ca-4bc020efddfe', 'a4bd654a-f8f1-44b4-907f-0114e1caa391', '6480385b-e9eb-45a9-88e3-aade6c90476d', '06f1dd04-cfbc-433c-9833-32cdb01c0683', 'bbdbec2b-0ce6-4f9c-ad2d-e6392388d4fb']","[60, 150, 180, 30, 120, 90, 0]","[0, 30, 60, 90, 120, 150, 180]","['grey', 'black', 'grey', 'black', 'black', 'grey', 'black']","[250, 550, 550, 550, 550, 250, 250]","['The dots were both fairly close to each other and were both moving around.', 'The dots were far apart from each other at first, then moved closer together to each other but they did not touch each other.', 'This time the dots moved around but they were further apart from each other and they did not touch each other.', 'The dots both moved in an anti clockwise direction, but again they did not touch each other.', 'The dots both moved towards each other but they did not touch each other.', 'The dots started of far apart and then both moved towards each other but they did not touch each other.', 'The black dot appeared to be following the grey dot.']",adults,"I tried to closely follow the dots as they moved, keeping my eyes on them at all times. I noted the direction they were travelling and how close they were to each other.","Very interesting and enjoyable task, thank you."
54,54,15054,65d39f8fe59355bdfbfea1a7,15,70,48,7,7,"['c188e383-94d7-475e-9da5-6d1f0a1184bb', '69cbd581-b3e6-4aa9-8cc0-319380d1e9ce', '8bb5c4ad-b420-47c6-8e6a-c74a127a30ce', '7d6cad69-203a-49a4-9c6e-b0423a669e50', '3d2cbd5f-05d3-4457-8c01-5b302d4c5de7', '4cd79935-2124-4c73-9bff-ce0554f08119', '124f53c2-90c6-4716-8221-e86088f8d257']","['8bb5c4ad-b420-47c6-8e6a-c74a127a30ce', '3d2cbd5f-05d3-4457-8c01-5b302d4c5de7', 'c188e383-94d7-475e-9da5-6d1f0a1184bb', '124f53c2-90c6-4716-8221-e86088f8d257', '7d6cad69-203a-49a4-9c6e-b0423a669e50', '4cd79935-2124-4c73-9bff-ce0554f08119', '69cbd581-b3e6-4aa9-8cc0-319380d1e9ce']","[60, 120, 0, 180, 90, 150, 30]","[0, 30, 60, 90, 120, 150, 180]","['grey', 'black', 'black', 'grey', 'grey', 'black', 'black']","[550, 550, 250, 250, 550, 550, 250]","['The light dot was chasing the dark dot', 'The dark dot was chasing the light dot', 'The dark dot was chasing the light dot, the light dot saw the dark dot a short while in', 'The dots movements were similar but seemingly unrelated', 'The light dot was chasing the dark dot. The dark dot saw the light dot a short time in', 'The dots movements were seemingly unrelated. The dark dot appeared confused', 'The dark dot was chasing the light dot']",something else (describe on the next page),"I didn't feel as if the dots represented anything, but it did seem like they were chasing each other. I didn't use any strategy that I am aware of.",An interesting task. No other comments.
55,55,15055,667eb7dbc8778a9fb2ba2407,15,71,48,7,7,"['72e764e1-0b34-4efd-96db-5df7934b2395', '17e4063d-b2f1-4406-8a8f-be7151fd23c1', '8d9b8961-4fb1-4413-b875-966e01b9963a', '1841b8a9-ff1d-481d-80de-2134f2461e8b', '94a4e86e-f727-4ed5-85c3-c9ab9c1c8e73', '275adee0-f228-423e-816a-e5e70b874bf3', '12a3cd27-040f-4199-9edb-5cd4bb71b3d0']","['8d9b8961-4fb1-4413-b875-966e01b9963a', '72e764e1-0b34-4efd-96db-5df7934b2395', '12a3cd27-040f-4199-9edb-5cd4bb71b3d0', '275adee0-f228-423e-816a-e5e70b874bf3', '17e4063d-b2f1-4406-8a8f-be7151fd23c1', '94a4e86e-f727-4ed5-85c3-c9ab9c1c8e73', '1841b8a9-ff1d-481d-80de-2134f2461e8b']","[60, 0, 180, 150, 30, 120, 90]","[0, 30, 60, 90, 120, 150, 180]","['black', 'grey', 'black', 'grey', 'black', 'black', 'grey']","[550, 550, 250, 250, 550, 250, 250]","['moving to the left and moving downwards slowly', 'dots moving upwards- one following the other dot', 'going around in a circle- opposing ends one top and towards bottom of screen', 'moving quickly left to right. dots didnt really move from where started', 'dots moved towards the left and then began to drop downwards towards the left', 'dark dot went up and down, grey dot moved in circular motion', 'light grey dot moved towards the right, dark dot moved up and down across screen']",animals,No,None
56,56,15056,6691ab7db3e2f87eb86ac544,15,65,48,7,7,"['9dfa52b0-9e95-49de-bddb-e53316f2b4ae', '0b80e3d6-cded-42b9-b7ff-67c9cdbcb3c5', '249089b6-ef6d-4ddb-973d-6d7b9d53baf8', '42ffed3d-edac-4ca7-9b33-6f525cb7c364', '1bc0b0c8-e058-4a68-bdab-65b544a8848d', '4270e833-4dad-483f-85cb-3dee1fccc571', '802575f0-631d-4eeb-9e49-3b401b11b953']","['802575f0-631d-4eeb-9e49-3b401b11b953', '0b80e3d6-cded-42b9-b7ff-67c9cdbcb3c5', '42ffed3d-edac-4ca7-9b33-6f525cb7c364', '1bc0b0c8-e058-4a68-bdab-65b544a8848d', '249089b6-ef6d-4ddb-973d-6d7b9d53baf8', '4270e833-4dad-483f-85cb-3dee1fccc571', '9dfa52b0-9e95-49de-bddb-e53316f2b4ae']","[180, 30, 90, 120, 60, 150, 0]","[0, 30, 60, 90, 120, 150, 180]","['black', 'grey', 'black', 'grey', 'black', 'grey', 'grey']","[550, 550, 250, 250, 250, 550, 550]","['They were moving randomly', 'they were moving toward the left side', 'they moved from middle to the bottom part', 'the black dot moved up the white dot was moving around the middle', 'they both dots were moving from middle to the upward part', 'the black dot was moving toward the upper left side while the white was in the middle', 'they both moved toward the upper left side ']",something else (describe on the next page),Yes,no
57,57,15057,6690434b96fb1ccec0f5c7d1,15,68,48,7,7,"['37b0c4a3-57d4-4b4a-9bf7-e4d2eb48cee6', 'c6499c88-e947-4ab5-8cde-3013da4d084f', 'a7fd07d1-e946-43a4-882d-0b3b7882ed21', '22162d51-e2bc-4fd2-af29-7d21f36eca1d', '987cd79f-7d6a-426b-8983-8bee8675f0ba', '9c46112a-3307-42b7-8386-bdf38ba679af', '2176e0c4-bf6c-4f4a-a64b-23825205a150']","['37b0c4a3-57d4-4b4a-9bf7-e4d2eb48cee6', 'c6499c88-e947-4ab5-8cde-3013da4d084f', '9c46112a-3307-42b7-8386-bdf38ba679af', '987cd79f-7d6a-426b-8983-8bee8675f0ba', 'a7fd07d1-e946-43a4-882d-0b3b7882ed21', '22162d51-e2bc-4fd2-af29-7d21f36eca1d', '2176e0c4-bf6c-4f4a-a64b-23825205a150']","[0, 30, 150, 120, 60, 90, 180]","[0, 30, 60, 90, 120, 150, 180]","['black', 'grey', 'grey', 'black', 'grey', 'black', 'grey']","[250, 250, 250, 550, 550, 250, 550]","['The black dot was following the grey dot into the corner ', 'The dots came together then the grey dot followed the black dot ', 'Both dots were staying a certain distance away from each other but moving the same way ', 'Black dot was copying the grey dot without getting close', 'Grey dot was following/pushing the black dot into the corner', 'The grey dot was moving in the same way of the black dot but not getting close to each other', 'The dots touched then went away from each other']",magnets,No,No
58,58,15058,60e38ac4db4d97422293672b,15,73,48,7,7,"['c188e383-94d7-475e-9da5-6d1f0a1184bb', 'a4bd654a-f8f1-44b4-907f-0114e1caa391', '804f9681-f112-463c-a764-a40a823d6845', 'ceedd529-39a5-4c29-8103-d6ac89521de6', 'a68cb7dc-2812-45a9-b8f6-862ff43630fb', '7e113c5d-92b4-4c01-9588-dae0fb76eb5f', '00ccc21a-d63a-41eb-8d3b-a2315d7b0d3e']","['00ccc21a-d63a-41eb-8d3b-a2315d7b0d3e', 'a68cb7dc-2812-45a9-b8f6-862ff43630fb', 'c188e383-94d7-475e-9da5-6d1f0a1184bb', '804f9681-f112-463c-a764-a40a823d6845', 'ceedd529-39a5-4c29-8103-d6ac89521de6', 'a4bd654a-f8f1-44b4-907f-0114e1caa391', '7e113c5d-92b4-4c01-9588-dae0fb76eb5f']","[180, 120, 0, 60, 90, 30, 150]","[0, 30, 60, 90, 120, 150, 180]","['grey', 'grey', 'black', 'black', 'grey', 'black', 'black']","[550, 550, 250, 250, 550, 550, 250]","['They were mirroring each other and moving at the same time', 'the grey dot was writing something and the black dot was just moving around', 'the black dot began to follow the grey dot', 'the black dot started chasing the grey dot', 'the grey dot started trying to catch up with the black dot', 'the black dot started following the grey and the grey moved in zig zags to try and avoid it', 'the grey dot was moving in the bottom right section of the square and the black was moving in the top left section']",adults,I watched the patterns of both dots to see if there was any relation,No
59,59,15059,641571922d04f807e7157a04,15,74,48,7,7,"['19c65966-3d88-4851-afe4-ae34c498748c', '31932267-3908-4599-ba56-ba5043757838', '8d9b8961-4fb1-4413-b875-966e01b9963a', '42ffed3d-edac-4ca7-9b33-6f525cb7c364', '5d69d5c8-83dd-43c4-be85-f1c2ff45960d', '2a1ab94f-201b-4fa2-9947-1eab7365fb0f', '4bc5af99-ede5-49ec-a929-d4fc6fae9b43']","['31932267-3908-4599-ba56-ba5043757838', '19c65966-3d88-4851-afe4-ae34c498748c', '4bc5af99-ede5-49ec-a929-d4fc6fae9b43', '42ffed3d-edac-4ca7-9b33-6f525cb7c364', '8d9b8961-4fb1-4413-b875-966e01b9963a', '2a1ab94f-201b-4fa2-9947-1eab7365fb0f', '5d69d5c8-83dd-43c4-be85-f1c2ff45960d']","[30, 0, 180, 90, 60, 150, 120]","[0, 30, 60, 90, 120, 150, 180]","['grey', 'grey', 'black', 'black', 'black', 'black', 'grey']","[250, 550, 550, 250, 550, 250, 550]","['the light dot was chasing the dark dot', 'the =dark dot nearly hit the light then turned', 'they were making circles', 'the dark dot was zig zagging.', 'the dark dot was closing in on the light dot', 'they were aimlessly going in different directions', 'they were chasing each other.']",balls,no i did not.,no
