,index,sub_ind,PID,date,stimset_rows,total_trials,nplanned_trialIDs,npresented_trialIDs,planned_trialIDs_all,presented_trialIDs_all,subtlety,subtlety_sorted,pred_color,pred_pos,responses,agents_type,strategy,feedback
35,35,15035,667a7551a3666990fac80091,15,44,48,7,7,"['47505654-05f0-4b92-a9a3-978c80bda46b', 'c53236a2-f564-41ec-89aa-2bd90765b0a4', '8bb5c4ad-b420-47c6-8e6a-c74a127a30ce', '1d4805c2-68cf-415b-af2f-f7c0564b59aa', '5d69d5c8-83dd-43c4-be85-f1c2ff45960d', '7e113c5d-92b4-4c01-9588-dae0fb76eb5f', '4a6f7598-dc16-47d6-987e-a48c1f938428']","['1d4805c2-68cf-415b-af2f-f7c0564b59aa', '47505654-05f0-4b92-a9a3-978c80bda46b', '5d69d5c8-83dd-43c4-be85-f1c2ff45960d', 'c53236a2-f564-41ec-89aa-2bd90765b0a4', '7e113c5d-92b4-4c01-9588-dae0fb76eb5f', '8bb5c4ad-b420-47c6-8e6a-c74a127a30ce', '4a6f7598-dc16-47d6-987e-a48c1f938428']","[90, 0, 120, 30, 150, 60, 180]","[0, 30, 60, 90, 120, 150, 180]","['black', 'black', 'grey', 'black', 'black', 'grey', 'grey']","[550, 550, 550, 250, 250, 550, 250]","['They were moving with fluctuations in a generally up-left motion', 'They both moved left, then the grey dot moved right for a short time but before making contact with the other moved down', 'They moved upward and closer to each other though never made contact', 'They moved right then down; the grey dot seemed to make moves to avoid contact with the black dot', 'The grey dot moved toward the bottom-right corner and then moved in a small circle, while the black dot made seemingly random movements and remained in largely the same area of the field', ""They both moved left; the black dot seemed to 'bounce' off of the left side of the field"", 'The grey dot moved around in the central-left area of the field while the black dot moved slowly down the right side']",animals,I attempted to remain with my intuitions as the movements seemed to be governed by highly complicated rather than linear directions,'What are they doing' is a vague question
36,36,15036,59f673018a2d3d00012c1544,15,42,48,7,7,"['72e764e1-0b34-4efd-96db-5df7934b2395', '0ea51ff3-f8ac-4d29-a981-0a167d74909c', 'adf2a5c5-86f0-4a90-976a-f3fdfdf528fc', 'ceedd529-39a5-4c29-8103-d6ac89521de6', '5d84c995-f49b-42d0-bf89-eb7f4bfcb1d4', '4cd79935-2124-4c73-9bff-ce0554f08119', '00139b14-fa60-4af8-9eba-0b4965060c34']","['72e764e1-0b34-4efd-96db-5df7934b2395', '00139b14-fa60-4af8-9eba-0b4965060c34', '4cd79935-2124-4c73-9bff-ce0554f08119', 'adf2a5c5-86f0-4a90-976a-f3fdfdf528fc', 'ceedd529-39a5-4c29-8103-d6ac89521de6', '0ea51ff3-f8ac-4d29-a981-0a167d74909c', '5d84c995-f49b-42d0-bf89-eb7f4bfcb1d4']","[0, 180, 150, 60, 90, 30, 120]","[0, 30, 60, 90, 120, 150, 180]","['grey', 'black', 'black', 'grey', 'grey', 'black', 'black']","[550, 250, 550, 250, 550, 250, 250]","['The grey one was following the black one', ""It looks like they're dancing"", ""The grey one was moving fast and the black one couldn't make up it's mind."", 'The grey one is slowly following the black one again', 'They came to each other and then the grey one followed the black one', 'Now the black one followed the grey one!', 'The black one is stalking the grey one.']",balls,"No, I just looked to see what they were doing",No it was fun!
37,37,15037,60ec7ea8d35da9b4118bdd56,15,46,48,7,7,"['816e0a69-dfb6-4a6f-8ffe-97d092e27835', '9093ecfa-6a76-4110-b88c-dd9330281781', '91659665-5079-44c4-96c1-49da784170fa', '22162d51-e2bc-4fd2-af29-7d21f36eca1d', '6480385b-e9eb-45a9-88e3-aade6c90476d', '2a1ab94f-201b-4fa2-9947-1eab7365fb0f', '124f53c2-90c6-4716-8221-e86088f8d257']","['91659665-5079-44c4-96c1-49da784170fa', '6480385b-e9eb-45a9-88e3-aade6c90476d', '2a1ab94f-201b-4fa2-9947-1eab7365fb0f', '22162d51-e2bc-4fd2-af29-7d21f36eca1d', '124f53c2-90c6-4716-8221-e86088f8d257', '816e0a69-dfb6-4a6f-8ffe-97d092e27835', '9093ecfa-6a76-4110-b88c-dd9330281781']","[60, 120, 150, 90, 180, 0, 30]","[0, 30, 60, 90, 120, 150, 180]","['grey', 'black', 'black', 'black', 'grey', 'black', 'grey']","[250, 550, 250, 250, 250, 550, 550]","['Travelling to the top right', 'Moving towards each other then away again', 'The light grey was repelling the black', 'Black trying to follow light grey', 'Light grey moving toward black, black making small circles toward top right', 'Black following light grey to bottom left', 'Light grey following black to top left']",magnets,None,No
38,38,15038,6078421a82b88488a16a2b1f,15,48,48,7,7,"['816e0a69-dfb6-4a6f-8ffe-97d092e27835', 'c53236a2-f564-41ec-89aa-2bd90765b0a4', '7b3797d6-d4cc-4819-b3ad-adfd144217e2', '89ce6bb6-b2cb-44cb-ba57-d78ab0224625', '87b8564c-7590-4001-b1e8-6f26c4e4bf8a', '99fed5db-be9d-4d5f-8fef-1baaad5f1b70', '4bc5af99-ede5-49ec-a929-d4fc6fae9b43']","['816e0a69-dfb6-4a6f-8ffe-97d092e27835', 'c53236a2-f564-41ec-89aa-2bd90765b0a4', '99fed5db-be9d-4d5f-8fef-1baaad5f1b70', '89ce6bb6-b2cb-44cb-ba57-d78ab0224625', '4bc5af99-ede5-49ec-a929-d4fc6fae9b43', '7b3797d6-d4cc-4819-b3ad-adfd144217e2', '87b8564c-7590-4001-b1e8-6f26c4e4bf8a']","[0, 30, 150, 90, 180, 60, 120]","[0, 30, 60, 90, 120, 150, 180]","['black', 'black', 'grey', 'black', 'black', 'grey', 'grey']","[550, 250, 550, 550, 550, 250, 250]","['The black dot is backing the grey one into a corner', 'The black dot is approaching the grey dot ', 'the grey dot is hovering around while the black dot is descending', 'the grey dot is rising with the black dot rising shortly behind', 'the grey dot is almost going around in circles, the black dot not so', 'the grey dot is approaching the black dot, backing it into a corner  (or against a wall)', 'both dots are descending with a bit of distance between them']",something else (describe on the next page),none,Nope
39,39,15039,64135c5f6cdfab4949d4b2ae,15,47,48,7,7,"['07cdb9d7-6577-428d-9498-8a7243527554', '17e4063d-b2f1-4406-8a8f-be7151fd23c1', '3273fde2-4b65-4cc7-b9b3-ef2604e8a514', '68c0fec8-cf83-48bf-8079-a5f414fe7504', '987cd79f-7d6a-426b-8983-8bee8675f0ba', '4270e833-4dad-483f-85cb-3dee1fccc571', '70f615a0-31d5-42b9-a44b-f5746c0b41a8']","['987cd79f-7d6a-426b-8983-8bee8675f0ba', '68c0fec8-cf83-48bf-8079-a5f414fe7504', '70f615a0-31d5-42b9-a44b-f5746c0b41a8', '3273fde2-4b65-4cc7-b9b3-ef2604e8a514', '4270e833-4dad-483f-85cb-3dee1fccc571', '17e4063d-b2f1-4406-8a8f-be7151fd23c1', '07cdb9d7-6577-428d-9498-8a7243527554']","[120, 90, 180, 60, 150, 30, 0]","[0, 30, 60, 90, 120, 150, 180]","['black', 'black', 'black', 'grey', 'grey', 'black', 'grey']","[550, 250, 250, 550, 550, 550, 250]","['The darker dot appeared to be attempting to move closer to the grey dot, however the grey dot did not appear to be consciously moving toward it or away from it.', 'The grey dot appeared to be actively moving away from the black dot, at one point it turned and headed toward the black dot but only seemingly as it approached the edge of the screen/border. It then resumed moving away', 'both dots appear to have been moving independently with no regard for what the other was doing. ', 'The grey dot appeared to be actively chasing the black dot. The black dot seemed to be purposefully moving away and trying to distance itself', 'Both dots appeared to be moving randomly, with no pattern or obvious trajectory and without recognition of each other', 'The black dot appeared to be chasing the grey dot which seemed to be actively moving away purposefully', 'The grey dot appeared to be chasing the black dot, and the black dot was making a constant effort to move further away from it']",animals,"I suppose I subconsciously placed an awareness/living status on each dot. I did not realise until the last couple of videos but I was perceiving that these entities were aware of each other and had different 'ides' of whether they wanted to be closer to the other, further, or were not concerned at all. To me, it seemed almost like two dogs or cats interacting with varying levels of interest in one another.",no
40,40,15040,613c56006d57a7ed16275b1b,15,51,48,7,7,"['bbdbec2b-0ce6-4f9c-ad2d-e6392388d4fb', '0ea51ff3-f8ac-4d29-a981-0a167d74909c', '3273fde2-4b65-4cc7-b9b3-ef2604e8a514', 'c7f85153-52e8-4379-839f-9596d6a3ee62', '5d69d5c8-83dd-43c4-be85-f1c2ff45960d', '1247c2a3-9c1a-478d-ad2b-6640715d76a4', '12a3cd27-040f-4199-9edb-5cd4bb71b3d0']","['c7f85153-52e8-4379-839f-9596d6a3ee62', '5d69d5c8-83dd-43c4-be85-f1c2ff45960d', 'bbdbec2b-0ce6-4f9c-ad2d-e6392388d4fb', '0ea51ff3-f8ac-4d29-a981-0a167d74909c', '12a3cd27-040f-4199-9edb-5cd4bb71b3d0', '1247c2a3-9c1a-478d-ad2b-6640715d76a4', '3273fde2-4b65-4cc7-b9b3-ef2604e8a514']","[90, 120, 0, 30, 180, 150, 60]","[0, 30, 60, 90, 120, 150, 180]","['grey', 'grey', 'black', 'black', 'black', 'black', 'grey']","[550, 550, 250, 250, 250, 250, 550]","['The grey one was following the black one cautiously', 'When they came close the black one moved away', 'The black one cornered the grey one', 'The black one followed the grey one to the edge', 'Both floating in their own spaces', 'Black one moving rigidly, grey one floating', 'When they came close, the grey one followed the black one']",animals,Tried to imagine them as something else e.g. animals and try to understand the 'body language' as such, No
41,41,15041,5950f9c0cb9b650001bf4dd5,15,52,48,7,7,"['c188e383-94d7-475e-9da5-6d1f0a1184bb', 'a4bd654a-f8f1-44b4-907f-0114e1caa391', 'a7fd07d1-e946-43a4-882d-0b3b7882ed21', '16088d09-c11d-4b03-8c77-f92a33554c1e', '9996b324-9da6-4bd7-a5d5-305513d257ce', '2a1ab94f-201b-4fa2-9947-1eab7365fb0f', '124f53c2-90c6-4716-8221-e86088f8d257']","['a7fd07d1-e946-43a4-882d-0b3b7882ed21', '9996b324-9da6-4bd7-a5d5-305513d257ce', 'a4bd654a-f8f1-44b4-907f-0114e1caa391', '2a1ab94f-201b-4fa2-9947-1eab7365fb0f', 'c188e383-94d7-475e-9da5-6d1f0a1184bb', '16088d09-c11d-4b03-8c77-f92a33554c1e', '124f53c2-90c6-4716-8221-e86088f8d257']","[60, 120, 30, 150, 0, 90, 180]","[0, 30, 60, 90, 120, 150, 180]","['grey', 'grey', 'black', 'black', 'black', 'black', 'grey']","[550, 250, 550, 250, 250, 550, 250]","['Grey dot was following the black dot', 'Grey dot was watching the black dot', 'Black dot was following the grey dot', 'Black dot was trying to get round grey dot', 'Black dot was chasing the grey dot', 'Grey dot was trying to get pas the Black dot.', 'Grey dot was watching the Black dot']",adults,no,no
42,42,15042,63e0ec61bae88c6bb36f5968,15,53,48,7,7,"['75182d69-6502-4d35-9298-e331061c7829', '0b80e3d6-cded-42b9-b7ff-67c9cdbcb3c5', 'adf2a5c5-86f0-4a90-976a-f3fdfdf528fc', '22162d51-e2bc-4fd2-af29-7d21f36eca1d', '3d2cbd5f-05d3-4457-8c01-5b302d4c5de7', '10a07293-2c74-4b8a-bbef-b0f436cde5fb', '802575f0-631d-4eeb-9e49-3b401b11b953']","['adf2a5c5-86f0-4a90-976a-f3fdfdf528fc', '3d2cbd5f-05d3-4457-8c01-5b302d4c5de7', '75182d69-6502-4d35-9298-e331061c7829', '802575f0-631d-4eeb-9e49-3b401b11b953', '0b80e3d6-cded-42b9-b7ff-67c9cdbcb3c5', '10a07293-2c74-4b8a-bbef-b0f436cde5fb', '22162d51-e2bc-4fd2-af29-7d21f36eca1d']","[60, 120, 0, 180, 30, 150, 90]","[0, 30, 60, 90, 120, 150, 180]","['grey', 'black', 'grey', 'black', 'grey', 'grey', 'black']","[250, 550, 250, 550, 550, 550, 250]","['Moving to top right hand corner.', 'moving slightly to the left but mostly around the middle.', 'Drifting to the right and then up.', 'quite apart. Black dot was drifting top right. Left dot was moving bottom left.', 'Moving from right to left with the grey dot moving with the black dot staying just in front.', 'getting closer together whilst rotating anti clockwise', 'slowly drifting right whilst moving up and down.']",balls,Trying to identify patterns of movement.,No.
43,43,15043,5e9872fda9de710844c3d21a,15,56,48,7,7,"['9dfa52b0-9e95-49de-bddb-e53316f2b4ae', '17e4063d-b2f1-4406-8a8f-be7151fd23c1', 'cca827ad-af9d-4cfd-ae71-7e028e3f8520', 'ceedd529-39a5-4c29-8103-d6ac89521de6', '7da9ad01-3df5-45e9-8edf-4af0795536e1', '7e113c5d-92b4-4c01-9588-dae0fb76eb5f', '7bee52f4-919b-4633-b742-a0181f5f7f01']","['cca827ad-af9d-4cfd-ae71-7e028e3f8520', 'ceedd529-39a5-4c29-8103-d6ac89521de6', '7e113c5d-92b4-4c01-9588-dae0fb76eb5f', '7da9ad01-3df5-45e9-8edf-4af0795536e1', '9dfa52b0-9e95-49de-bddb-e53316f2b4ae', '17e4063d-b2f1-4406-8a8f-be7151fd23c1', '7bee52f4-919b-4633-b742-a0181f5f7f01']","[60, 90, 150, 120, 0, 30, 180]","[0, 30, 60, 90, 120, 150, 180]","['black', 'grey', 'black', 'black', 'grey', 'black', 'grey']","[550, 550, 250, 250, 550, 550, 250]","['Black dot was heading towards grey dot', 'Grey dot was following black dot. Both moving downwards.', 'Dots were not related to eachothers movements', 'Movements not related, black heading towards grey slightly', 'Grey tracking black dot directly', 'Black following grey dot', 'Moving independently ']",balls,Watching the movement of each dot in relation to eachother to see if they followed the movement of the other one.,No feedback
44,44,15044,5ce059ad3f8060001509faaa,15,54,48,7,7,"['37b0c4a3-57d4-4b4a-9bf7-e4d2eb48cee6', 'cf5e29cd-eacd-4164-96d2-05de1fad88ba', '804f9681-f112-463c-a764-a40a823d6845', '1d4805c2-68cf-415b-af2f-f7c0564b59aa', 'b7261f19-79df-4505-b935-0cb890ebda9c', '18487641-212a-4e1e-8730-31709d721382', '00ccc21a-d63a-41eb-8d3b-a2315d7b0d3e']","['804f9681-f112-463c-a764-a40a823d6845', '18487641-212a-4e1e-8730-31709d721382', 'cf5e29cd-eacd-4164-96d2-05de1fad88ba', '00ccc21a-d63a-41eb-8d3b-a2315d7b0d3e', '37b0c4a3-57d4-4b4a-9bf7-e4d2eb48cee6', 'b7261f19-79df-4505-b935-0cb890ebda9c', '1d4805c2-68cf-415b-af2f-f7c0564b59aa']","[60, 150, 30, 180, 0, 120, 90]","[0, 30, 60, 90, 120, 150, 180]","['black', 'grey', 'black', 'grey', 'black', 'grey', 'black']","[250, 250, 550, 550, 250, 550, 550]","['black is following grey', 'black and grey are unrelated and black is moving down', 'like two little birds flying together', 'both going in circles at different times', 'black following grey up to the top right and beyond like takingoff', 'both doing their own thing but repel each other when they get close', 'towards end they were mimicking each other']",magnets,"not really i just looked at what i was seeing and types what i felt related to them birds, magnets",none
45,45,15045,668d45d68f6124c42ed68f30,15,50,48,7,7,"['53613c0d-b07e-4b22-b6ec-56dda26edc8f', '57dbdc86-9c49-4214-a908-c4a254e90229', '35fbacfe-f7fd-45d5-9266-5f6631809d11', 'a8c7fb1b-9db5-4f8f-a05c-2ea241668e0f', 'a68cb7dc-2812-45a9-b8f6-862ff43630fb', '4cd79935-2124-4c73-9bff-ce0554f08119', '70f615a0-31d5-42b9-a44b-f5746c0b41a8']","['35fbacfe-f7fd-45d5-9266-5f6631809d11', 'a68cb7dc-2812-45a9-b8f6-862ff43630fb', '4cd79935-2124-4c73-9bff-ce0554f08119', '70f615a0-31d5-42b9-a44b-f5746c0b41a8', 'a8c7fb1b-9db5-4f8f-a05c-2ea241668e0f', '53613c0d-b07e-4b22-b6ec-56dda26edc8f', '57dbdc86-9c49-4214-a908-c4a254e90229']","[60, 120, 150, 180, 90, 0, 30]","[0, 30, 60, 90, 120, 150, 180]","['black', 'grey', 'black', 'black', 'grey', 'grey', 'grey']","[250, 550, 550, 250, 250, 250, 550]","['Black dot is chasing the grey dot', 'The black dot appeared to still want to chase they grey dot but the grey dot was watching for it', 'The black dot appeared to be stalknig the grey dot from a distance before losing interest', 'both dots were interested in each other but did not want to actually make contact', 'grey dot was chasing the black dot but the black dot kept a set distance away', 'grey dot was chasing black dot but could only go a single speed. the black dot was faster and could escape', 'grey dot chasing black dot but they became locked on a horizontal axis at the same distance']",animals,concentrated on one dot to see how the other moved in my peripheral vision,No
46,46,15046,667ed0f7182101c92b5944cf,15,57,48,7,7,"['19c65966-3d88-4851-afe4-ae34c498748c', '69cbd581-b3e6-4aa9-8cc0-319380d1e9ce', '91659665-5079-44c4-96c1-49da784170fa', '1841b8a9-ff1d-481d-80de-2134f2461e8b', '5d84c995-f49b-42d0-bf89-eb7f4bfcb1d4', '4270e833-4dad-483f-85cb-3dee1fccc571', '0ea53c63-8350-4a50-8dec-ccbbf0e401dc']","['69cbd581-b3e6-4aa9-8cc0-319380d1e9ce', '91659665-5079-44c4-96c1-49da784170fa', '4270e833-4dad-483f-85cb-3dee1fccc571', '19c65966-3d88-4851-afe4-ae34c498748c', '5d84c995-f49b-42d0-bf89-eb7f4bfcb1d4', '0ea53c63-8350-4a50-8dec-ccbbf0e401dc', '1841b8a9-ff1d-481d-80de-2134f2461e8b']","[30, 60, 150, 0, 120, 180, 90]","[0, 30, 60, 90, 120, 150, 180]","['black', 'grey', 'grey', 'grey', 'black', 'black', 'grey']","[250, 250, 550, 550, 250, 550, 250]","['they were moving to the bottom right of screen', 'they were moving to the top right of screen', 'they were moving slightly to left of screen', 'they were moving more quickly to left of screen', 'they were drifting to top right of screen', 'they were moving in small curves slightly to left', 'they were moving slightly together and then apart, ending closer together']",animals,"remembering where they began and ended, alternating between looking at each one",no
47,47,15047,66316a9edb13102a55ca5889,15,61,48,7,7,"['47505654-05f0-4b92-a9a3-978c80bda46b', '31932267-3908-4599-ba56-ba5043757838', '85aa46c9-fe72-469c-a4cd-96f72ab4ccba', 'c7f85153-52e8-4379-839f-9596d6a3ee62', '5d84c995-f49b-42d0-bf89-eb7f4bfcb1d4', '7e113c5d-92b4-4c01-9588-dae0fb76eb5f', '7bee52f4-919b-4633-b742-a0181f5f7f01']","['85aa46c9-fe72-469c-a4cd-96f72ab4ccba', '31932267-3908-4599-ba56-ba5043757838', '47505654-05f0-4b92-a9a3-978c80bda46b', '7bee52f4-919b-4633-b742-a0181f5f7f01', '5d84c995-f49b-42d0-bf89-eb7f4bfcb1d4', '7e113c5d-92b4-4c01-9588-dae0fb76eb5f', 'c7f85153-52e8-4379-839f-9596d6a3ee62']","[60, 30, 0, 180, 120, 150, 90]","[0, 30, 60, 90, 120, 150, 180]","['black', 'grey', 'black', 'grey', 'black', 'black', 'grey']","[550, 250, 550, 250, 250, 250, 550]","['Black dot was following and tailing the grey one', 'Grey dot was following/tailing the black dot', 'Black dot was following/tailing the grey dot', 'Grey dot was following the black dot from a distance', 'Dots were hovering in sync almost ', 'Dots were moving almost in sync, ', 'Dots were hovering towards the bottom left of the screen almost in sync']",animals,No,No
48,48,15048,66912ec01375ab0291c69f62,15,60,48,7,7,"['49e5ac90-6e7f-4243-9552-8c4c10545895', 'c53236a2-f564-41ec-89aa-2bd90765b0a4', '91659665-5079-44c4-96c1-49da784170fa', 'ceedd529-39a5-4c29-8103-d6ac89521de6', 'a68cb7dc-2812-45a9-b8f6-862ff43630fb', '10a07293-2c74-4b8a-bbef-b0f436cde5fb', '70f615a0-31d5-42b9-a44b-f5746c0b41a8']","['49e5ac90-6e7f-4243-9552-8c4c10545895', 'ceedd529-39a5-4c29-8103-d6ac89521de6', '91659665-5079-44c4-96c1-49da784170fa', '10a07293-2c74-4b8a-bbef-b0f436cde5fb', 'a68cb7dc-2812-45a9-b8f6-862ff43630fb', '70f615a0-31d5-42b9-a44b-f5746c0b41a8', 'c53236a2-f564-41ec-89aa-2bd90765b0a4']","[0, 90, 60, 150, 120, 180, 30]","[0, 30, 60, 90, 120, 150, 180]","['black', 'grey', 'grey', 'grey', 'grey', 'black', 'black']","[550, 550, 250, 550, 550, 250, 250]","['The black dot was chasing the grey dot. The grey was moving quickly and wavering around, the black was moving slowly and steadily in a smooth line.', 'Gray was chasing black dot, black was trying to evade when it became aware of grey.', 'Grey was chasing black dot, black was getting stuck in a corner.', 'Black dot was following a predetermined path (spelling something about) grey was moving around randomly', 'Grey dot was following a back and forth jagged pattern, black dot was moving around slowly and smoothly in curved paths', 'Black dot was travelling diagonally SW to NE, grey dot was moving around jerkly in a small area', 'Black was moving towards grey, grey was swaying back and forth and moving away from black']",animals,"Tried to see both dots at the same time, tried to categorise movement (e.g. into smooth/jerk, direction of travel, area covered) and tried to determine if dots were moving in relation to/response to each other","Really hard to tell if I did it ""well"" or how it was supposed to be done"
49,49,15049,6580d346a0f8984f8d5b8ee4,15,58,48,7,7,"['07cdb9d7-6577-428d-9498-8a7243527554', '9093ecfa-6a76-4110-b88c-dd9330281781', '85aa46c9-fe72-469c-a4cd-96f72ab4ccba', '7d6cad69-203a-49a4-9c6e-b0423a669e50', '987cd79f-7d6a-426b-8983-8bee8675f0ba', '9c46112a-3307-42b7-8386-bdf38ba679af', '00139b14-fa60-4af8-9eba-0b4965060c34']","['85aa46c9-fe72-469c-a4cd-96f72ab4ccba', '7d6cad69-203a-49a4-9c6e-b0423a669e50', '00139b14-fa60-4af8-9eba-0b4965060c34', '9093ecfa-6a76-4110-b88c-dd9330281781', '07cdb9d7-6577-428d-9498-8a7243527554', '9c46112a-3307-42b7-8386-bdf38ba679af', '987cd79f-7d6a-426b-8983-8bee8675f0ba']","[60, 90, 180, 30, 0, 150, 120]","[0, 30, 60, 90, 120, 150, 180]","['black', 'grey', 'black', 'grey', 'grey', 'grey', 'black']","[550, 550, 250, 550, 250, 250, 550]","['Grey was going in a zig zag pattern from bottom to top on the left side. Black was going in a similar pattern from middle to top left.', 'Grey was going in a small movement pattern from right to left. Black started doing similar towards grey from left to right, but then turned as if running from gray.', 'Black is going in a small circular pattern along the horizontal center line but on the left half of the box. Grey was doing the similar pattern in the middle top of the box.', 'Black made  a short move to the top left corner then traced along the top of the box back right. Grey started more central and did the same. Since grey had further to travel it was behind black and seemed to follow black along the top of the box.', 'Both fell towards the bottom right corner. Black started in the middle and fell less distance. Grey started a little right of middle but from much higher.', 'Grey drew a pattern on the left side of the box while black did similar on the right. Both were going down as they made their pattern. Greys was a bit more dynamic, with some circling and quick up/downs at one point.', 'I paid a lot of attention to gray on the left. Both appear to be making patterns, maybe a letter or number at times? Since I was focusing on grey it seems it drew a lowercase letter q. Unsure what black drew. ']",something else (describe on the next page),I think it was perhaps letters it was drawing. I tried to focus on both balls so didn't pick up on this early on. If I had just focused in on one ball I would have noticed this sooner.,None
50,50,15050,6684268336ebea5d57930a0f,15,62,48,7,7,"['816e0a69-dfb6-4a6f-8ffe-97d092e27835', '0ea51ff3-f8ac-4d29-a981-0a167d74909c', '3273fde2-4b65-4cc7-b9b3-ef2604e8a514', 'a8c7fb1b-9db5-4f8f-a05c-2ea241668e0f', '5d69d5c8-83dd-43c4-be85-f1c2ff45960d', '18487641-212a-4e1e-8730-31709d721382', '4bc5af99-ede5-49ec-a929-d4fc6fae9b43']","['3273fde2-4b65-4cc7-b9b3-ef2604e8a514', '816e0a69-dfb6-4a6f-8ffe-97d092e27835', 'a8c7fb1b-9db5-4f8f-a05c-2ea241668e0f', '5d69d5c8-83dd-43c4-be85-f1c2ff45960d', '0ea51ff3-f8ac-4d29-a981-0a167d74909c', '4bc5af99-ede5-49ec-a929-d4fc6fae9b43', '18487641-212a-4e1e-8730-31709d721382']","[60, 0, 90, 120, 30, 180, 150]","[0, 30, 60, 90, 120, 150, 180]","['grey', 'black', 'grey', 'grey', 'black', 'black', 'grey']","[550, 550, 250, 550, 250, 550, 250]","[""The grey dot was 'chasing' the black dot"", 'The black dot was chasing the grey dot', 'Grey was chasing black, but blacks movement seemed slightly more erratic', ""Initially they went towards each other, but ultimately black 'ran away'"", 'They initially moved together, then black chased grey and grey moved away', 'They were independently drawing small circles and moving, but not impacted by each other', ""They appeared to be 'doing their own thing' and not be impacted by each other until they got very close, then avoiding action was taken""]",magnets,Not really... imagination?,No
51,51,15051,5c7bb4095dcdda001427a670,15,64,48,7,7,"['19c65966-3d88-4851-afe4-ae34c498748c', '0a730462-ba50-4dbe-97c6-911f61a40346', 'cca827ad-af9d-4cfd-ae71-7e028e3f8520', '16088d09-c11d-4b03-8c77-f92a33554c1e', '87b8564c-7590-4001-b1e8-6f26c4e4bf8a', '2a1ab94f-201b-4fa2-9947-1eab7365fb0f', '4a6f7598-dc16-47d6-987e-a48c1f938428']","['0a730462-ba50-4dbe-97c6-911f61a40346', '19c65966-3d88-4851-afe4-ae34c498748c', 'cca827ad-af9d-4cfd-ae71-7e028e3f8520', '87b8564c-7590-4001-b1e8-6f26c4e4bf8a', '4a6f7598-dc16-47d6-987e-a48c1f938428', '2a1ab94f-201b-4fa2-9947-1eab7365fb0f', '16088d09-c11d-4b03-8c77-f92a33554c1e']","[30, 0, 60, 120, 180, 150, 90]","[0, 30, 60, 90, 120, 150, 180]","['grey', 'grey', 'black', 'grey', 'grey', 'black', 'black']","[250, 550, 550, 250, 250, 250, 550]","['The grey dot was floating and chasing the black dot around the screen', 'The black dot started going in circles and was the followed by the grey dot', 'The black dot followed the grey dot into the top left corner', 'both dots were floating towards each other. the grey dot was moving faster than the black dot.', 'the black dot was moving in circles near the bottom right corner while the grey was doing the same near the top left corner.', 'the dots were both making circles and floating around the centre of the screen', 'the black dot was chasing the grey dot']",balls,none,n/a
52,52,15052,59bc25620ac77f0001f05574,15,69,48,7,7,"['53613c0d-b07e-4b22-b6ec-56dda26edc8f', 'cf5e29cd-eacd-4164-96d2-05de1fad88ba', 'adf2a5c5-86f0-4a90-976a-f3fdfdf528fc', '1d4805c2-68cf-415b-af2f-f7c0564b59aa', '9996b324-9da6-4bd7-a5d5-305513d257ce', '14f7fa8d-a7a5-4171-bdbf-8a076fb08d9c', '0ea53c63-8350-4a50-8dec-ccbbf0e401dc']","['9996b324-9da6-4bd7-a5d5-305513d257ce', 'cf5e29cd-eacd-4164-96d2-05de1fad88ba', '53613c0d-b07e-4b22-b6ec-56dda26edc8f', 'adf2a5c5-86f0-4a90-976a-f3fdfdf528fc', '14f7fa8d-a7a5-4171-bdbf-8a076fb08d9c', '0ea53c63-8350-4a50-8dec-ccbbf0e401dc', '1d4805c2-68cf-415b-af2f-f7c0564b59aa']","[120, 30, 0, 60, 150, 180, 90]","[0, 30, 60, 90, 120, 150, 180]","['grey', 'black', 'grey', 'grey', 'black', 'black', 'black']","[250, 550, 250, 250, 550, 550, 550]","['the grey dot was following the black dot without getting to close', 'the black dot was chasing the grey dot around the screen', 'it looked like the grey dot was trying to tag the black dot', 'the black dot was running away from the grey dot', 'it looked like the black dot could not decide whether to chase or run away from the grey dot', 'the two dots were trying to get away from each other without going to far from each other', 'the black dot was chasing the grey dot from a distance']",balls,looked to see what try of pattern the dots where doing,none
