,subID,stimset_rows,chargeSpeed,stim_dur,responses,movie,trial_num,similarity_play,similarity_fight,similarity_play_fight
2,28007,33,5.25,7735,Dots moves around slowly quite far apart. Then accelerated at each other from quite far away. One dot started accelerating before the other,9cf1ba8f-113d-408d-831d-4cf31ca51b3b,2,0.09735748171806335,0.08414260298013687,0.013214878737926483
2,28008,31,5.25,8260,"When the dots are within a certain range of eachother, they are pulled in and collide",4cf04acf-6776-453a-a811-1c5e51c2ece4,2,0.1341964602470398,0.1378762125968933,-0.0036797523498535156
0,28009,41,5.25,8108,collision,04b8ff17-66ff-4d6b-a0aa-a91efebb4368,0,0.2893446385860443,0.45200881361961365,-0.16266417503356934
1,28010,39,5.25,8245,the dots collided ,5f5a825b-b433-4986-b5d6-5239eb407d32,1,0.22630006074905396,0.2632363736629486,-0.03693631291389465
6,28011,40,5.25,8051,collided twice,1b4e0da1-e8b8-4342-8d4f-9d2a551e7fed,6,0.23222286999225616,0.33481013774871826,-0.1025872677564621
0,28012,42,5.25,7989,The two dots bounced off each other,8b72023d-88b1-4615-b871-cac794edf1d9,0,0.19534239172935486,0.13861621916294098,0.05672617256641388
6,28013,42,5.25,8172,the dots moved around and collided with each other but not too aggressively x2,8b72023d-88b1-4615-b871-cac794edf1d9,6,0.15323002636432648,0.13185429573059082,0.021375730633735657
4,28014,45,5.25,8019,again the grey started moving toward the black dot  and they hit each other,2d3d47a2-03c8-4642-84ec-a8f67c64868c,4,0.19897770881652832,0.2356511652469635,-0.03667345643043518
5,28015,46,5.25,8256,dots hit each other but more like dancing,35ae5b09-f580-4922-91bd-f22c23175a47,5,0.25197598338127136,0.18292003870010376,0.0690559446811676
1,28016,51,5.25,8014,clashes,9cf1ba8f-113d-408d-831d-4cf31ca51b3b,1,0.2990168035030365,0.4895833134651184,-0.1905665099620819
6,28017,48,5.25,8033,black attacking gray then collision,27f4d7f8-d998-48b2-a3e4-f885f21c713d,6,0.224087655544281,0.3762662708759308,-0.15217861533164978
0,28018,47,5.25,8065,The 2 dots remained separate & abruptly collided twice.,5f5a825b-b433-4986-b5d6-5239eb407d32,0,0.08141455054283142,0.09798870235681534,-0.016574151813983917
4,28019,52,5.25,8042,the dots were moving freely before choosing to redirect and collide with each other simultaneously,8e0deaa9-1ac5-4e69-817a-3204f157f360,4,0.12617656588554382,0.08861426264047623,0.037562303245067596
6,28020,49,5.25,8010,"random movement, medium force collision",2ef99e5f-bc49-429b-b086-41ed4571b58a,6,0.16014324128627777,0.20351970195770264,-0.043376460671424866
1,28021,58,5.25,8322,the dots moved towards the right then collided together.,39d4c0f1-9195-4761-98c6-457bad8a2291,1,0.17959067225456238,0.13690969347953796,0.042680978775024414
0,28022,59,5.25,8021,The two dots were moving and sometimes they crashed each other.,82cc23d1-ba4b-48c5-995a-a30d865ea249,0,0.12941546738147736,0.09178776293992996,0.037627704441547394
3,28023,66,5.25,7960,they slowly attracted and repelled,8a889364-bfa4-42f7-8d4c-ee7478ea863c,3,0.0815410241484642,0.15966857969760895,-0.07812755554914474
2,28024,65,5.25,7952,now they hit eachother twice again but the black one seemed more aggressive,86e934a2-75ef-4084-a167-ce0ca737532d,2,0.15032504498958588,0.3553045094013214,-0.20497946441173553
2,28025,63,5.25,8060,dots seemed to drift away from each other and then toward each other in brief intervals,0a4312a1-7156-4c68-9698-0f1495558bee,2,0.08582766354084015,0.05763561651110649,0.028192047029733658
3,28026,64,5.25,8034,touched each other twice,2d3d47a2-03c8-4642-84ec-a8f67c64868c,3,0.21830852329730988,0.23248018324375153,-0.01417165994644165
1,28027,71,5.25,8397,"The dots moved away from eachother and bumped into eachother two times, they were also spinning around",9cf1ba8f-113d-408d-831d-4cf31ca51b3b,1,0.0920182317495346,0.08214320242404938,0.00987502932548523
2,28028,68,5.25,8029,"Both dots hit each other, the black hit first then both dots hit at the same time.",4cf04acf-6776-453a-a811-1c5e51c2ece4,2,0.16951104998588562,0.15353262424468994,0.01597842574119568
6,28029,67,5.25,8178,this one was tricky because at first it looked like the dots each had different motions before being pulled in together,8e0deaa9-1ac5-4e69-817a-3204f157f360,6,0.09913140535354614,0.05830547958612442,0.04082592576742172
4,28030,74,5.25,8048,mirroring each other and colliding,39d4c0f1-9195-4761-98c6-457bad8a2291,4,0.20994330942630768,0.242142915725708,-0.03219960629940033
2,28031,80,5.25,8032,slammed,8e0deaa9-1ac5-4e69-817a-3204f157f360,2,0.32306915521621704,0.41255515813827515,-0.0894860029220581
6,28032,73,5.25,8025,the balls switched sides,8b72023d-88b1-4615-b871-cac794edf1d9,6,0.3278696537017822,0.14375965297222137,0.18411000072956085
5,28033,83,5.25,8084,opposites attract. like a magnet,5f5a825b-b433-4986-b5d6-5239eb407d32,5,0.08706661313772202,0.12063449621200562,-0.0335678830742836
2,28034,81,5.25,8288,"They would attack each other quite quickly, the black dot moved first",124d9b3a-acac-4627-93e0-f05b493598f3,2,0.11833306401968002,0.19901491701602936,-0.08068185299634933
0,28035,84,5.25,8106,floating bounce,35ae5b09-f580-4922-91bd-f22c23175a47,0,0.2545641362667084,0.1761603206396103,0.07840381562709808
2,28036,76,5.25,8034,collided,5f5a825b-b433-4986-b5d6-5239eb407d32,2,0.3351637125015259,0.48290887475013733,-0.14774516224861145
3,28037,77,5.25,8242,The dots moved at the same speed apart then together,124d9b3a-acac-4627-93e0-f05b493598f3,3,0.0996350347995758,0.04887562245130539,0.050759412348270416
1,28038,86,5.25,8145,They were hitting each other then moving away and doing it again.,0a4312a1-7156-4c68-9698-0f1495558bee,1,0.20833556354045868,0.33954450488090515,-0.13120894134044647
0,28039,90,5.25,7830,The two dots clashed twice,46786fd0-ca59-4ffa-a772-fe489fdbd94c,0,0.1610245406627655,0.19609959423542023,-0.035075053572654724
1,28040,92,5.25,8058,bumped into each other,39d4c0f1-9195-4761-98c6-457bad8a2291,1,0.229865163564682,0.2991226315498352,-0.0692574679851532
1,28041,85,5.25,9363,defensive,86e934a2-75ef-4084-a167-ce0ca737532d,1,0.34166914224624634,0.36764395236968994,-0.025974810123443604
0,28042,91,5.25,7963,collided twice,4cf04acf-6776-453a-a811-1c5e51c2ece4,0,0.23222286999225616,0.33481013774871826,-0.1025872677564621
0,28043,99,5.25,8012,Bumped together,9ed3a785-369e-4eb1-b5ca-50d2602a44d4,0,0.22778558731079102,0.27269527316093445,-0.04490968585014343
2,28044,96,5.25,8104,slow headon collision,1b4e0da1-e8b8-4342-8d4f-9d2a551e7fed,2,0.09869904071092606,0.20780900120735168,-0.10910996049642563
6,28045,97,5.25,8305,rivals,04b8ff17-66ff-4d6b-a0aa-a91efebb4368,6,0.2929207980632782,0.4044734537601471,-0.1115526556968689
1,28046,94,5.25,8055,Both dots moving then the grey one moved sharply and bumped against the black one twice,384dc3de-9717-4531-83a1-683588fe1381,1,0.15820229053497314,0.0866861641407013,0.07151612639427185
6,28047,95,5.25,8206,"Dots moved around and grey started to move faster towards black dot and then they black one reacted and also move faster towards grey dot and then they hit each other then they moved apart, this happened twice.",82cc23d1-ba4b-48c5-995a-a30d865ea249,6,0.17549508810043335,0.16087709367275238,0.01461799442768097
5,28048,89,5.25,8282,The two dot meet each other twice,27f4d7f8-d998-48b2-a3e4-f885f21c713d,5,0.1703105866909027,0.18755799531936646,-0.017247408628463745
0,28049,88,5.25,8069,The black dot was moving towards the gray dot and it hit the grey dot twice,8b72023d-88b1-4615-b871-cac794edf1d9,0,0.18501675128936768,0.1342075765132904,0.05080917477607727
3,28050,98,5.25,8365,the ball came together ,2d3d47a2-03c8-4642-84ec-a8f67c64868c,3,0.36724188923835754,0.19984933733940125,0.1673925518989563
2,28051,4,5.25,8539,2 dots collide,9cf1ba8f-113d-408d-831d-4cf31ca51b3b,2,0.18481053411960602,0.22042830288410187,-0.03561776876449585
6,28052,6,5.25,8556,i dont know,9ed3a785-369e-4eb1-b5ca-50d2602a44d4,6,0.1709401160478592,0.22996512055397034,-0.059025004506111145
1,28053,3,5.25,8131,Colliding ,82cc23d1-ba4b-48c5-995a-a30d865ea249,1,0.3238259553909302,0.4559154212474823,-0.13208946585655212
0,28054,8,5.25,7982,ai,39d4c0f1-9195-4761-98c6-457bad8a2291,0,0.3245834410190582,0.28159013390541077,0.04299330711364746
3,28055,2,5.25,8233,the grey dot quickly hits the black,8a889364-bfa4-42f7-8d4c-ee7478ea863c,3,0.20721931755542755,0.15217754244804382,0.05504177510738373
0,28056,4,5.25,8040,collide,9cf1ba8f-113d-408d-831d-4cf31ca51b3b,0,0.27803245186805725,0.4310681223869324,-0.15303567051887512
3,28057,14,5.25,8026,collided,1b4e0da1-e8b8-4342-8d4f-9d2a551e7fed,3,0.3351637125015259,0.48290887475013733,-0.14774516224861145
6,28058,13,5.25,10128,the black dot seem to be the one causing an issue in this case,27f4d7f8-d998-48b2-a3e4-f885f21c713d,6,0.10341373831033707,0.027929749339818954,0.07548398897051811
4,28059,80,5.25,8040,"The dots were a little towards the left side of the box and moved slightly in a upward motion before moving towards each other to make contact twice. This time they moved faster than previously. They did not move lighting fast, but they did not move slowly either.",8e0deaa9-1ac5-4e69-817a-3204f157f360,4,0.04322938248515129,-0.008814569562673569,0.05204395204782486
3,28060,19,5.25,8045,bounced off each other twice,35ae5b09-f580-4922-91bd-f22c23175a47,3,0.2541846036911011,0.2752717435359955,-0.02108713984489441
1,28061,19,5.25,8062,collided quickly and bounced off,35ae5b09-f580-4922-91bd-f22c23175a47,1,0.17543286085128784,0.23184171319007874,-0.056408852338790894
6,28062,27,5.25,8008,collisions,27f4d7f8-d998-48b2-a3e4-f885f21c713d,6,0.25414302945137024,0.39464882016181946,-0.14050579071044922
0,28063,16,5.25,9403,Bounced off each other,2d3d47a2-03c8-4642-84ec-a8f67c64868c,0,0.28413257002830505,0.32616397738456726,-0.04203140735626221
2,28064,17,5.25,8097,They clashed twice,0a4312a1-7156-4c68-9698-0f1495558bee,2,0.19621983170509338,0.394891619682312,-0.19867178797721863
4,28065,29,5.25,7990,this one is harded....but slower bouncing into one another,0a4312a1-7156-4c68-9698-0f1495558bee,4,0.1670905351638794,0.20292437076568604,-0.03583383560180664
1,28066,25,5.25,8113,"The dots each made a u shaped then rapidly hit each other, this was done twice.",1b4e0da1-e8b8-4342-8d4f-9d2a551e7fed,1,0.11296644061803818,0.05347341299057007,0.05949302762746811
6,28067,32,5.25,8010,The dots moved in a similar pattern but the light grey dot moved much more quickly before touching I think twice.,04b8ff17-66ff-4d6b-a0aa-a91efebb4368,6,0.07541510462760925,-0.045546941459178925,0.12096204608678818
2,28068,27,5.25,8121,"black dot was the aggressor and appeared to go for the other one, bumping it twice",27f4d7f8-d998-48b2-a3e4-f885f21c713d,2,0.15378940105438232,0.1666441559791565,-0.01285475492477417
5,28069,35,5.25,8017,move together,46786fd0-ca59-4ffa-a772-fe489fdbd94c,5,0.27648693323135376,0.3562858998775482,-0.07979896664619446
5,28070,26,5.25,8162,The dots moved to the middle at the bottom and collided twice gently.,384dc3de-9717-4531-83a1-683588fe1381,5,0.1595149040222168,0.08210472762584686,0.07741017639636993
4,28071,33,5.25,8080,slow joining,9cf1ba8f-113d-408d-831d-4cf31ca51b3b,4,0.2403780221939087,0.17890289425849915,0.061475127935409546
2,28072,21,5.25,8058,Meeting and separating ,124d9b3a-acac-4627-93e0-f05b493598f3,2,0.12962695956230164,0.23747508227825165,-0.10784812271595001
2,28073,35,5.25,7925,"the black dot seemed to chase the grey dot, and clashed with it twice",46786fd0-ca59-4ffa-a772-fe489fdbd94c,2,0.14126244187355042,0.12816229462623596,0.013100147247314453
2,28074,38,5.25,8144,running towards each other,8a889364-bfa4-42f7-8d4c-ee7478ea863c,2,0.32402923703193665,0.2709081470966339,0.053121089935302734
0,28075,30,5.25,8622,they kissed each otehr,9ed3a785-369e-4eb1-b5ca-50d2602a44d4,0,0.11804545670747757,0.24554309248924255,-0.12749763578176498
1,28076,31,5.25,8291,"drifting apart, then coming together",4cf04acf-6776-453a-a811-1c5e51c2ece4,1,0.20399029552936554,0.3091128170490265,-0.10512252151966095
6,28077,39,5.25,8547,spun one direction then collided in the center then moved back the other direction before hitting again in the center,5f5a825b-b433-4986-b5d6-5239eb407d32,6,0.1720055788755417,0.17000992596149445,0.001995652914047241
3,28078,40,5.25,8500,"one dot circled, the other more straight lined",1b4e0da1-e8b8-4342-8d4f-9d2a551e7fed,3,0.103248730301857,0.08996564894914627,0.013283081352710724
6,28079,23,5.25,8030,link,39d4c0f1-9195-4761-98c6-457bad8a2291,6,0.23363721370697021,0.2361033856868744,-0.002466171979904175
4,28080,42,5.25,8137,"collide gently, move away and collide strongly",8b72023d-88b1-4615-b871-cac794edf1d9,4,0.1914387345314026,0.2919497787952423,-0.10051104426383972
4,28081,43,5.25,8001,they are attracting each other,0a4312a1-7156-4c68-9698-0f1495558bee,4,0.1991536170244217,0.2574503421783447,-0.058296725153923035
0,28082,44,5.25,8008,attract and collide,86e934a2-75ef-4084-a167-ce0ca737532d,0,0.1408713310956955,0.24624542891979218,-0.10537409782409668
6,28083,46,5.25,8040,grey dot was attacking black dot,35ae5b09-f580-4922-91bd-f22c23175a47,6,0.21162693202495575,0.18796896934509277,0.023657962679862976
1,28084,47,5.25,8164,the speed of repel between the 2 dot is slower than before,5f5a825b-b433-4986-b5d6-5239eb407d32,1,0.07520058006048203,0.06967070698738098,0.005529873073101044
0,28085,51,5.25,8019,collision,9cf1ba8f-113d-408d-831d-4cf31ca51b3b,0,0.2893446385860443,0.45200881361961365,-0.16266417503356934
1,28086,50,5.25,8304,they are trying to communicate,384dc3de-9717-4531-83a1-683588fe1381,1,0.19528348743915558,0.2426936775445938,-0.04741019010543823
4,28087,48,5.25,8070,"If I had to explain the interaction of the dots, it is as if they were destined to fight each other",27f4d7f8-d998-48b2-a3e4-f885f21c713d,4,0.13504895567893982,0.26887503266334534,-0.13382607698440552
2,28088,52,5.25,8213,the two dots was not that friendly to each other,8e0deaa9-1ac5-4e69-817a-3204f157f360,2,0.11650067567825317,0.11707761138677597,-0.0005769357085227966
0,28089,53,5.25,7996,Circular movement but then attacked each other,8a889364-bfa4-42f7-8d4c-ee7478ea863c,0,0.15866513550281525,0.2692299783229828,-0.11056484282016754
2,28090,49,5.25,8199,bouncing on each other,2ef99e5f-bc49-429b-b086-41ed4571b58a,2,0.28407368063926697,0.26406848430633545,0.02000519633293152
5,28091,54,5.25,7908,attacking,46786fd0-ca59-4ffa-a772-fe489fdbd94c,5,0.3938009738922119,0.5579482316970825,-0.1641472578048706
5,28092,55,5.25,8367,"Slow movements, then bacl initiates two moments of contact",124d9b3a-acac-4627-93e0-f05b493598f3,5,0.10947876423597336,0.11091022193431854,-0.0014314576983451843
1,28093,56,5.25,8023,two dots mirroring movement and crashing into eachother,4cf04acf-6776-453a-a811-1c5e51c2ece4,1,0.1584520936012268,0.11195813119411469,0.04649396240711212
3,28094,57,5.25,8035,They circled below the box on the right side and contacted each other two times,9ed3a785-369e-4eb1-b5ca-50d2602a44d4,3,0.033008020371198654,0.08894184976816177,-0.05593382939696312
5,28095,60,5.25,8015,slow clash and rebound,384dc3de-9717-4531-83a1-683588fe1381,5,0.3019178509712219,0.3312341570854187,-0.029316306114196777
1,28096,59,5.25,8299,The white dot attracts the black dot with a greater force and bounces off and this happens twice.  ,82cc23d1-ba4b-48c5-995a-a30d865ea249,1,0.11099226772785187,0.06785635650157928,0.04313591122627258
3,28097,58,5.25,8375,slow movement ,39d4c0f1-9195-4761-98c6-457bad8a2291,3,0.2339448481798172,0.2257649004459381,0.00817994773387909
1,28098,64,5.25,7977,Dots collided.,2d3d47a2-03c8-4642-84ec-a8f67c64868c,1,0.21945597231388092,0.2513359487056732,-0.0318799763917923
3,28099,63,5.25,9931,The dots collided randomly,0a4312a1-7156-4c68-9698-0f1495558bee,3,0.17804273962974548,0.13261988759040833,0.04542285203933716
1,28100,66,5.25,8173,The animations were colliding in slow rhythm,8a889364-bfa4-42f7-8d4c-ee7478ea863c,1,0.13530613481998444,0.1933877319097519,-0.058081597089767456
4,28101,65,5.25,8102,the dots moving round and touching each other,86e934a2-75ef-4084-a167-ce0ca737532d,4,0.1462184637784958,0.09735620021820068,0.048862263560295105
2,28102,67,5.25,8144,The dots collided two times,8e0deaa9-1ac5-4e69-817a-3204f157f360,2,0.18643423914909363,0.2021392434835434,-0.015705004334449768
0,28000,26,6.5,8025,collided and then moved apart,8bee64f6-a3cb-48f4-be48-142b9065f5d7,0,0.19350317120552063,0.27690476179122925,-0.08340159058570862
6,28001,25,6.5,7976,The grey dot was higher than the black dot,1827c058-6388-491a-b84c-d4d6c512039e,6,0.10552992671728134,0.07109954953193665,0.034430377185344696
0,28002,28,6.5,8392,they hit each other twice,93e661c0-3f68-4205-9141-04164911b7e4,0,0.23231199383735657,0.38577577471733093,-0.15346378087997437
2,28003,29,6.5,8061,"The black dot moved toward the grey dot first, after which the grey dot bumped into the black dot. This happened twice.",e3160d16-fe5e-4987-918b-0921ab937804,2,0.10961458832025528,0.05534464120864868,0.0542699471116066
1,28004,32,6.5,8134,floating around and then suddenly ran into each other. this happened twice,3c21b0c7-30d1-41a7-99ae-02e24be36ad3,1,0.17590856552124023,0.2118588536977768,-0.03595028817653656
4,28005,35,6.5,8163,harshly bashing together,5456278f-d454-4194-af69-2784112cffb9,4,0.15907299518585205,0.35070177912712097,-0.19162878394126892
4,28006,36,6.5,9301,Connect fast then slow,2c174300-1111-477c-b605-e34e6031cd26,4,0.20600973069667816,0.172966867685318,0.03304286301136017
1,28007,33,6.5,7739,"Dot moved around slowly, then sped up into each each. This happened twice",8dbfdd79-2b3f-4297-8ec2-92d59884dd68,1,0.14316312968730927,0.05893264338374138,0.08423048630356789
5,28008,31,6.5,8290,"The dots gravitate towards eachother and collide when they are far away, but this time they collide slower",13e24563-ab7e-41df-adf6-e8e88b4d9e08,5,0.08883503824472427,0.11800641566514969,-0.029171377420425415
5,28009,41,6.5,8165,leading astray,13e24563-ab7e-41df-adf6-e8e88b4d9e08,5,0.250211626291275,0.1750880777835846,0.07512354850769043
6,28010,39,6.5,8216,provoked collision,d98f2d5f-eb3b-4ebd-b714-878343382f2a,6,0.25422194600105286,0.4452871084213257,-0.19106516242027283
2,28011,40,6.5,8015,became attracted to each other and combined twice,ed3846d1-c7e9-4e73-a1ab-cd413d18c0b8,2,0.12355873733758926,0.19598449766635895,-0.07242576032876968
3,28012,42,6.5,8058,The dots traded hits while floating about,187f8493-9a30-43cc-a2bd-5d96f6d2263d,3,0.21327750384807587,0.1753649264574051,0.037912577390670776
1,28013,42,6.5,8347,the two dots moved around and then the black dot moved closer to the grey dot and collided x2.,187f8493-9a30-43cc-a2bd-5d96f6d2263d,1,0.14369644224643707,0.11535286158323288,0.028343580663204193
1,28014,45,6.5,8126,the dots hit each other then backed away from each other then hit eachother again and backed away again,d98f2d5f-eb3b-4ebd-b714-878343382f2a,1,0.20269587635993958,0.20604421198368073,-0.00334833562374115
4,28015,46,6.5,8220,the dots bounced off one another. almost looked like they were fighting this time,debe6245-13a4-4a31-b28a-e7b25ce8fa93,4,0.14211706817150116,0.30669519305229187,-0.1645781248807907
4,28016,51,6.5,7939,attack,14c0e4c6-94d9-41ec-b44a-5f6c8678230e,4,0.36563640832901,0.5875464081764221,-0.2219099998474121
4,28017,48,6.5,8010,chase then attack,93e661c0-3f68-4205-9141-04164911b7e4,4,0.2873367667198181,0.3602061867713928,-0.07286942005157471
3,28018,47,6.5,8045,The dots moved in their own space & then abruptly moved together twice.,8dbfdd79-2b3f-4297-8ec2-92d59884dd68,3,0.08564218878746033,0.043505728244781494,0.04213646054267883
0,28019,52,6.5,7971,the grey dot swept towards the black dot and then the black dot re-directed so they collided together,2c174300-1111-477c-b605-e34e6031cd26,0,0.16069519519805908,0.15757668018341064,0.0031185150146484375
3,28020,49,6.5,7908,"grey dot shadowed black, then rammed it",e3160d16-fe5e-4987-918b-0921ab937804,3,0.1799013316631317,0.1354570984840393,0.04444423317909241
0,28021,58,6.5,8164,the dots collided into eachother repeatedly,8bee64f6-a3cb-48f4-be48-142b9065f5d7,0,0.17744362354278564,0.19781172275543213,-0.020368099212646484
4,28022,59,6.5,8007,The dots following each other and sometimes crashed one another.,3c21b0c7-30d1-41a7-99ae-02e24be36ad3,4,0.14081385731697083,0.11214917153120041,0.028664685785770416
4,28023,66,6.5,7833,they attracted and repelled,2fa02aa8-ef06-46e0-87af-9e3b7267ee79,4,0.10056866705417633,0.19981564581394196,-0.09924697875976562
4,28024,65,6.5,7904,same as before,1827c058-6388-491a-b84c-d4d6c512039e,4,0.2355787754058838,0.22005949914455414,0.015519276261329651
1,28025,63,6.5,8180,dots would charge at each other to the point of colliding. one dot always started the charge and the other seemed to brace itself for impact,5456278f-d454-4194-af69-2784112cffb9,1,0.08043470233678818,0.10463087260723114,-0.024196170270442963
0,28026,64,6.5,7992,they crashed twice,40860eea-1c44-4896-96b1-ee2d42a6c522,0,0.15555869042873383,0.19510246813297272,-0.03954377770423889
3,28027,71,6.5,8274,Dots surged together once and then more gently bumped another time,e2c787c5-5358-4a21-bb35-c422b37ef982,3,0.11915931850671768,0.0789223164319992,0.040237002074718475
0,28028,68,6.5,8027,Both dots struck each other twice head on.,debe6245-13a4-4a31-b28a-e7b25ce8fa93,0,0.13127906620502472,0.16139428317546844,-0.030115216970443726
4,28029,67,6.5,8271,"the black and grey dot has equal force in being pulled together. At first, it looked like the black dot was initiating the force then in the other bump it looked as though the grey dot was initiating the force",d98f2d5f-eb3b-4ebd-b714-878343382f2a,4,0.08628551661968231,0.11254829168319702,-0.02626277506351471
2,28030,74,6.5,7995,magnetic attraction,e3160d16-fe5e-4987-918b-0921ab937804,2,0.11756567656993866,0.11223334074020386,0.005332335829734802
6,28031,80,6.5,8029,changed who went first to hit,40860eea-1c44-4896-96b1-ee2d42a6c522,6,0.18813225626945496,0.21005183458328247,-0.021919578313827515
2,28032,73,6.5,8058,they attacked each other more quickly,187f8493-9a30-43cc-a2bd-5d96f6d2263d,2,0.1228029727935791,0.375400573015213,-0.2525976002216339
1,28033,83,6.5,8159,short circular and then attraction,187f8493-9a30-43cc-a2bd-5d96f6d2263d,1,0.08597976714372635,0.11926363408565521,-0.033283866941928864
3,28034,81,6.5,8269,"The grey dot attacked the black dot first, moved very suddenly",13e24563-ab7e-41df-adf6-e8e88b4d9e08,3,0.14605672657489777,0.13450999557971954,0.011546730995178223
6,28035,84,6.5,8031,fast hitting black dot,2fa02aa8-ef06-46e0-87af-9e3b7267ee79,6,0.251425176858902,0.19878795742988586,0.05263721942901611
1,28036,76,6.5,8068,fought,ed3846d1-c7e9-4e73-a1ab-cd413d18c0b8,1,0.3440033197402954,0.8571767807006836,-0.5131734609603882
0,28037,77,6.5,8287,The dots moved slowly apart then together quickly,d80f638e-7e4b-4e80-bc19-a4b764fd7614,0,0.1384900063276291,0.07478220015764236,0.06370780616998672
0,28038,86,6.5,7965,They were colliding with each other.,1827c058-6388-491a-b84c-d4d6c512039e,0,0.20359058678150177,0.3581188917160034,-0.15452830493450165
6,28039,90,6.5,7979,The two dots clashed at medium speed,8bee64f6-a3cb-48f4-be48-142b9065f5d7,6,0.09792039543390274,0.13009145855903625,-0.032171063125133514
0,28040,92,6.5,8018,bumped into each other,3c21b0c7-30d1-41a7-99ae-02e24be36ad3,0,0.229865163564682,0.2991226315498352,-0.0692574679851532
5,28041,85,6.5,9291,collision,7c59d616-cf70-400a-8ebd-9b3cdfb854ec,5,0.2893446385860443,0.45200881361961365,-0.16266417503356934
6,28042,91,6.5,8008,gentle nudging ,5456278f-d454-4194-af69-2784112cffb9,6,0.14679808914661407,0.17352508008480072,-0.026726990938186646
6,28043,99,6.5,8015,faster,ed3846d1-c7e9-4e73-a1ab-cd413d18c0b8,6,0.27189943194389343,0.3136264979839325,-0.04172706604003906
5,28044,96,6.5,8136,sticky attraction leading to collision,e3160d16-fe5e-4987-918b-0921ab937804,5,0.09466512501239777,0.1863347589969635,-0.09166963398456573
1,28045,97,6.5,8293,drama ,debe6245-13a4-4a31-b28a-e7b25ce8fa93,1,0.34722900390625,0.4300053119659424,-0.08277630805969238
0,28046,94,6.5,7958,dots moved randomly then twice bumped against each other,2c174300-1111-477c-b605-e34e6031cd26,0,0.14095281064510345,0.06507962197065353,0.07587318867444992
1,28047,95,6.5,8302,"Both dots moved simultaneously and then all of the sudden move towards each other and punched each other, then moved then dashed to each other again and punched.",755a600e-d336-4f66-8771-52eed84faf02,1,0.18063637614250183,0.299663782119751,-0.11902740597724915
1,28048,89,6.5,8363,The dots hit each other twice,93e661c0-3f68-4205-9141-04164911b7e4,1,0.20531651377677917,0.17889970541000366,0.026416808366775513
2,28049,88,6.5,8286,The dots floated around each other before hitting each other twice ,8dbfdd79-2b3f-4297-8ec2-92d59884dd68,2,0.19593937695026398,0.13221177458763123,0.06372760236263275
2,28050,98,6.5,8369,the ball fast  hit each other ,d80f638e-7e4b-4e80-bc19-a4b764fd7614,2,0.34600770473480225,0.22696974873542786,0.11903795599937439
3,28051,4,6.5,8470,two dots meet at a point,5456278f-d454-4194-af69-2784112cffb9,3,0.16199539601802826,0.160291388630867,0.0017040073871612549
5,28052,6,6.5,8271,the two dots are hitting one another,2fa02aa8-ef06-46e0-87af-9e3b7267ee79,5,0.21751563251018524,0.18395183980464935,0.03356379270553589
0,28053,3,6.5,8001,Attacking,187f8493-9a30-43cc-a2bd-5d96f6d2263d,0,0.3938009738922119,0.5579482316970825,-0.1641472578048706
3,28054,8,6.5,8058,8,debe6245-13a4-4a31-b28a-e7b25ce8fa93,3,0.27217021584510803,0.33356648683547974,-0.061396270990371704
6,28055,2,6.5,8286,The black dot is pushing to hit the grey,93e661c0-3f68-4205-9141-04164911b7e4,6,0.21759678423404694,0.18205991387367249,0.03553687036037445
2,28056,4,6.5,8164,They charged at each other,5456278f-d454-4194-af69-2784112cffb9,2,0.18732555210590363,0.29260244965553284,-0.10527689754962921
0,28057,14,6.5,7959,collided,2c174300-1111-477c-b605-e34e6031cd26,0,0.3351637125015259,0.48290887475013733,-0.14774516224861145
